{
  "$schema": "https://json-schema.org/draft/2020-12/schema",
  "title": "card-profile",
  "description": "One reference-model card, defined. Every claim-bearing field is a `claim` object that either cites records and carries a verbatim quote from their SOURCE text, or is marked proposed. There is no third option: a field with no evidence is either absent or proposed. Nothing here may be asserted.",
  "type": "object",
  "additionalProperties": false,
  "required": ["address", "card", "area", "status", "definition", "standards", "tools", "landscape", "usage", "gaps"],
  "properties": {
    "address": {"type": "string", "pattern": "^([1-7]|base|rail)\\.[0-9]+$", "description": "journey address, e.g. 3.4 or rail.5"},
    "card": {"type": "string"},
    "area": {"type": "string"},
    "status": {"enum": ["built", "planned"], "description": "carried from the reference model, not re-decided here"},
    "schema_note": {"type": "string", "description": "why this profile carries fields the older 32 do not; free prose, never a claim"},

    "definition": {"$ref": "#/$defs/claim", "description": "what this element is, in one or two sentences"},

    "operations": {"$ref": "#/$defs/claim", "description": "the verb set this boundary exposes AND the order they occur in, cited. Optional: added after docs/reference/profile-sufficiency.md found that a card describing what a boundary IS never says what it DOES. Required in practice where the card names a standard's field or verb; a card describing a practice rather than an interface may honestly have nothing to put here, and that belongs in gaps."},
    "domain": {"$ref": "#/$defs/claim", "description": "for every standard field the card names, its legal values - not only that the field is required"},
    "failures": {"$ref": "#/$defs/claim", "description": "the typed failures at this boundary, cited to the standard the card claims to be checked against, including what a path that has never run must return"},
    "vocabulary": {"$ref": "#/$defs/claim", "description": "for every configurable word the card grants a caller: its legal values AND the step it applies at. A knob whose step is unstated is a knob that can be built unreachable - and was."},
    "swap_axis": {"$ref": "#/$defs/claim", "description": "what a second implementation must differ on for the swap to be real. `tools[]` lists what fills the card and does not rank by distance; two entries there can be the same execution model."},

    "standards": {
      "type": "array",
      "description": "standards governing this element. An empty array is a real answer and must be explained in gaps.",
      "items": {
        "type": "object",
        "additionalProperties": false,
        "required": ["id", "role", "evidence"],
        "properties": {
          "id": {"type": "string", "description": "directory name under standards/, e.g. oci-runtime-spec"},
          "role": {"type": "string", "description": "what part of this card the standard actually governs"},
          "covers": {"type": "string", "description": "what it does NOT cover, where that matters"},
          "evidence": {"$ref": "#/$defs/claim"}
        }
      }
    },

    "tools": {
      "type": "array",
      "description": "real implementations that fill this slot today",
      "items": {
        "type": "object",
        "additionalProperties": false,
        "required": ["name", "evidence"],
        "properties": {
          "name": {"type": "string"},
          "kind": {"enum": ["open-source", "hosted", "commercial", "standard-implementation", "unknown"]},
          "note": {"type": "string", "description": "what distinguishes it"},
          "in_use_here": {"type": "boolean", "description": "true only if this repo actually uses it"},
          "evidence": {"$ref": "#/$defs/claim"}
        }
      }
    },

    "landscape": {"$ref": "#/$defs/claim", "description": "how the options differ and what the real tradeoff is"},
    "usage": {"$ref": "#/$defs/claim", "description": "how a caller uses this element - the shape of the call, not a tutorial"},

    "gaps": {
      "type": "array",
      "description": "what is missing, unsettled or uncited. An empty list is itself a claim and is usually wrong.",
      "items": {
        "type": "object",
        "additionalProperties": false,
        "required": ["what"],
        "properties": {
          "what": {"type": "string"},
          "why_it_matters": {"type": "string"},
          "research_query": {"type": "string", "description": "the search that would close it"}
        }
      }
    }
  },

  "$defs": {
    "claim": {
      "type": "object",
      "additionalProperties": false,
      "required": ["text", "origin"],
      "description": "The unit of trust. origin=sourced carries `evidence`: one {id, quote} pair per cited record, where each quote appears verbatim in that record's SOURCE text (its snippet or read field) - never in the record's own claim field, which is this repo's prose about a source. A citation is an id AND a quote together: an id with no quote is decoration, since nothing ties the record to the claim, and it cannot be expressed in this shape. origin=proposed carries no evidence and its text must say so.",
      "properties": {
        "text": {"type": "string", "minLength": 1},
        "origin": {"enum": ["sourced", "proposed"]},
        "evidence": {
          "type": "array",
          "minItems": 1,
          "description": "required when origin is sourced; every cited record brings its own quote",
          "items": {
            "type": "object",
            "additionalProperties": false,
            "required": ["id", "quote"],
            "properties": {
              "id": {"type": "string", "pattern": "^(F|T|X|E|R|A|REF)-"},
              "quote": {"type": "string", "minLength": 12, "description": "verbatim substring of THIS record's snippet or read"}
            }
          }
        }
      },
      "allOf": [
        {
          "if": {"properties": {"origin": {"const": "sourced"}}, "required": ["origin"]},
          "then": {"required": ["evidence"]}
        },
        {
          "if": {"properties": {"origin": {"const": "proposed"}}, "required": ["origin"]},
          "then": {"not": {"required": ["evidence"]}}
        }
      ]
    }
  }
}
