{
  "address": "base.1",
  "card": "Source Control",
  "area": "Shared Platform Services",
  "status": "built",
  "schema_note": "Fifth profile authored with the five fields from docs/reference/profile-sufficiency.md, and the first where the sufficiency note's remaining hedge - a card describing a practice rather than an interface - was expected to bite. It did not: git-worktree turns out to be interface-shaped, with a named verb set, a value domain, four typed refusals and a knob whose override has two levels. What is missing here is not the fields, it is a standard: see gaps. The quotes also come from outside this card's indexed source pool, which is recorded rather than glossed.",
  "definition": {
    "text": "Source Control at this card is the durable, versioned store of the code an agent changes, plus the mechanism that gives a concurrent run its own checkout of that store without copying it. The mechanism has a one-line subject -- \"Manage multiple working trees attached to the same repository.\" -- and a stated reason to exist: \"A git repository can support multiple working trees, allowing you to check\nout more than one branch at a time. With git worktree add a new working\ntree is associated with the repository, along with additional metadata\nthat differentiates that working tree from others in the same repository.\nThe working tree, along with this metadata, is called a \"worktree\".\" The card's second half is the gate over that store: \"CI/CD pipelines are the fundamental component of GitLab CI/CD. Pipelines are configured\nin a .gitlab-ci.yml file by using YAML keywords.\"",
    "origin": "sourced",
    "evidence": [
      {
        "id": "X-refmodel-base-1-source-control-001",
        "quote": "Manage multiple working trees attached to the same repository."
      },
      {
        "id": "X-refmodel-base-1-source-control-002",
        "quote": "A git repository can support multiple working trees, allowing you to check\nout more than one branch at a time. With git worktree add a new working\ntree is associated with the repository, along with additional metadata\nthat differentiates that working tree from others in the same repository.\nThe working tree, along with this metadata, is called a \"worktree\"."
      },
      {
        "id": "X-refmodel-base-1-source-control-009",
        "quote": "CI/CD pipelines are the fundamental component of GitLab CI/CD. Pipelines are configured\nin a .gitlab-ci.yml file by using YAML keywords."
      }
    ]
  },
  "operations": {
    "text": "Eight verbs at the checkout boundary, named by the documentation's own synopsis rather than inferred -- \"git worktree add [-f] [--detach] [--checkout] [--lock [--reason <string>]]\n[--orphan] [(-b | -B) <new-branch>] <path> [<commit-ish>]\ngit worktree list [-v | --porcelain [-z]]\ngit worktree lock [--reason <string>] <worktree>\ngit worktree move <worktree> <new-path>\ngit worktree prune [-n] [-v] [--expire <expire>]\ngit worktree remove [-f] <worktree>\ngit worktree repair [<path>…​]\ngit worktree unlock <worktree>\" The ordering constraints, which docs/reference/profile-sufficiency.md asks for in preference to a sequence: add precedes every other verb for a given worktree and remove ends it; lock and unlock are inverses and either may be repeated; prune is the only verb that acts on worktrees nobody named, and it acts on ones already gone. The CI half has its own ordering, and it is stated as sequence plus parallelism rather than as a verb list: \"Stages, which define how to group jobs together. Stages run in sequence, while the jobs\nin a stage run in parallel. For example, an early stage could have jobs that lint and compile\ncode, while later stages could have jobs that test and deploy code. If all jobs in a stage succeed,\nthe pipeline moves on to the next stage. If any job in a stage fails, the next stage\nis not (usually) executed and the pipeline ends early.\"",
    "origin": "sourced",
    "evidence": [
      {
        "id": "X-refmodel-base-1-source-control-004",
        "quote": "git worktree add [-f] [--detach] [--checkout] [--lock [--reason <string>]]\n[--orphan] [(-b | -B) <new-branch>] <path> [<commit-ish>]\ngit worktree list [-v | --porcelain [-z]]\ngit worktree lock [--reason <string>] <worktree>\ngit worktree move <worktree> <new-path>\ngit worktree prune [-n] [-v] [--expire <expire>]\ngit worktree remove [-f] <worktree>\ngit worktree repair [<path>…​]\ngit worktree unlock <worktree>"
      },
      {
        "id": "X-refmodel-base-1-source-control-011",
        "quote": "Stages, which define how to group jobs together. Stages run in sequence, while the jobs\nin a stage run in parallel. For example, an early stage could have jobs that lint and compile\ncode, while later stages could have jobs that test and deploy code. If all jobs in a stage succeed,\nthe pipeline moves on to the next stage. If any job in a stage fails, the next stage\nis not (usually) executed and the pipeline ends early."
      }
    ]
  },
  "domain": {
    "text": "The checkout kind is a two-value domain with a cardinality rule attached, which is the part a builder needs: \"This new worktree is called a \"linked worktree\" as opposed to the \"main\nworktree\" prepared by git-init[1] or git-clone[1].\nA repository has one main worktree (if it’s not a bare repository) and\nzero or more linked worktrees. When you are done with a linked worktree,\nremove it with git worktree remove.\" So 'how many checkouts may exist' has a precise answer -- one main, unless the repository is bare and then none, plus any number of linked -- and the main one is not interchangeable with the others (it cannot be removed; see `failures`). The gate's outcome domain is stated through its effect rather than as a list of statuses: \"Stages, which define how to group jobs together. Stages run in sequence, while the jobs\nin a stage run in parallel. For example, an early stage could have jobs that lint and compile\ncode, while later stages could have jobs that test and deploy code. If all jobs in a stage succeed,\nthe pipeline moves on to the next stage. If any job in a stage fails, the next stage\nis not (usually) executed and the pipeline ends early.\" A stage either succeeds wholly and the next one starts, or it fails and the pipeline ends early.",
    "origin": "sourced",
    "evidence": [
      {
        "id": "X-refmodel-base-1-source-control-003",
        "quote": "This new worktree is called a \"linked worktree\" as opposed to the \"main\nworktree\" prepared by git-init[1] or git-clone[1].\nA repository has one main worktree (if it’s not a bare repository) and\nzero or more linked worktrees. When you are done with a linked worktree,\nremove it with git worktree remove."
      },
      {
        "id": "X-refmodel-base-1-source-control-011",
        "quote": "Stages, which define how to group jobs together. Stages run in sequence, while the jobs\nin a stage run in parallel. For example, an early stage could have jobs that lint and compile\ncode, while later stages could have jobs that test and deploy code. If all jobs in a stage succeed,\nthe pipeline moves on to the next stage. If any job in a stage fails, the next stage\nis not (usually) executed and the pipeline ends early."
      }
    ]
  },
  "failures": {
    "text": "Four typed refusals, each with the condition that raises it and the override that defeats it -- and they are the most concretely specified failures of any card profiled here so far. Adding: \"By default, add refuses to create a new worktree when\n<commit-ish> is a branch name and is already checked out by\nanother worktree, or if <path> is already assigned to some\nworktree but is missing (for instance, if <path> was deleted\nmanually). This option overrides these safeguards. To add a missing but\nlocked worktree path, specify --force twice.\" Moving: \"move refuses to move a locked worktree unless --force is specified\ntwice. If the destination is already assigned to some other worktree but is\nmissing (for instance, if <new-path> was deleted manually), then --force\nallows the move to proceed; use --force twice if the destination is locked.\" Removing: \"remove refuses to remove an unclean worktree unless --force is used.\nTo remove a locked worktree, specify --force twice.\" Creating the branch that a new checkout will sit on: \"By default, -b refuses to create a new branch if it already\nexists. -B overrides this safeguard, resetting <new-branch> to\n<commit-ish>.\" Two things are worth reading off this set rather than left implicit. The refusals are *safeguards with a stated escape*, not errors -- so a platform that decides source control for a caller is choosing which safeguards to keep, and the honest default is to keep all of them. And the override is graded: one --force defeats an unclean or already-assigned worktree, two defeat a lock. A lock is therefore a stronger statement than uncommitted work, which is a design fact a builder would otherwise invent. Proposed: what a path that has never run must return is unanswered here too, because this repo has built no adapter at this card. Sixth card, same answer.",
    "origin": "sourced",
    "evidence": [
      {
        "id": "X-refmodel-base-1-source-control-005",
        "quote": "By default, add refuses to create a new worktree when\n<commit-ish> is a branch name and is already checked out by\nanother worktree, or if <path> is already assigned to some\nworktree but is missing (for instance, if <path> was deleted\nmanually). This option overrides these safeguards. To add a missing but\nlocked worktree path, specify --force twice."
      },
      {
        "id": "X-refmodel-base-1-source-control-006",